keyword,title,description,slug,category,monetization,tags,featured_image_gen_prompt
"alternative to facebook groups","EXPOSED: Why Facebook Groups Are Secretly Killing Your Community (And What Creators Are Switching To)","Feeling trapped by Facebook's algorithm? You're not alone. Thousands of creators watched their thriving communities vanish overnight. Discover the exodus happening right now, and why serious community builders are quietly making one critical change before it's too late.",facebook-groups-alternative,platform-comparison,$0,facebook migration|community platform|algorithm changes|creator control,high quality, HD, detailed, High resolution image of a frustrated creator looking at analytics showing declining Facebook group engagement, with a brighter alternative community platform interface visible on a second screen
"community platform with monetization","Cash-Generating Communities: The Untapped Revenue Model Elite Creators Won't Share","They've been building fortunes right under your nose. While you struggle with complicated funnels, top creators quietly pocket $10K-50K monthly from a single platform. No more piecing together broken systems – see the exact model they're using before everyone else catches on.",monetization-community-platform,monetization-strategies,$997,passive income|membership revenue|community monetization|recurring revenue,high quality, HD, detailed, High resolution image of a creator looking at multiple revenue streams flowing in from a community platform dashboard, with shocked expression at the earnings display
"how to monetize online community","The 72-Hour Community Cash System: Transform Dead Groups Into Consistent 5-Figure Monthly Income","'I nearly gave up on my community until I tried this...' Discover the exact 3-step framework that rescued a failing 5K member group and turned it into a $137K/month revenue machine. Warning: This works even with small communities, but only if you implement it before your competitors.",monetize-online-community,monetization-strategies,$697,revenue generation|passive income|membership site|community monetization,high quality, HD, detailed, High resolution image of a community dashboard transformation, showing before/after metrics with dramatic revenue increase, calculator and strategy notebooks visible
"fitness community platform","FITNESS EMPIRE BLUEPRINT: The Exact System 7-Figure Trainers Use To Build Cult-Like Following (While Others Struggle With $10 Ebooks)","What if your fitness knowledge could generate more in a month than most trainers make yearly? Elite fitness creators aren't selling workouts anymore—they're building something far more valuable. See the exact platform they're using to create unshakeable client loyalty while automating 90% of their business.",fitness-community-blueprint,niche-communities,$1997,fitness business|online coaching|recurring revenue|community building,high quality, HD, detailed, High resolution image of a fitness professional looking at multiple community engagement screens showing workouts, nutrition plans and client interactions, with revenue charts growing dramatically
"trading community software","WALL STREET INSIDERS PANIC: Retail Traders Building Secret Communities That Outperform Hedge Funds","The trading elite don't want you to see this. Discover how ordinary traders are pooling knowledge in specialized communities and consistently beating institutional investors. This emerging platform is creating more independent financial success stories than any trading course or signal service.",trading-community-platform,niche-communities,$2997,investment groups|stock trading|financial freedom|market analysis,high quality, HD, detailed, High resolution image of traders collaborating in a digital community environment, with multiple charts showing market performance gains compared to institutional investors
"Skool vs Circle","BATTLE TESTED: I Spent $15,000 Testing Skool vs Circle (The Truth No One's Telling You)","The demos won't show you this. After moving 5 communities and 23,000 members between platforms, I discovered shocking differences no comparison article mentions. Before you lock yourself into the wrong platform, see the real-world test results that changed everything for us.",skool-vs-circle,platform-comparison,$197,platform review|community software|creator tools|software comparison,high quality, HD, detailed, High resolution image of a creator's desk with multiple screens showing Skool and Circle interfaces side by side, with handwritten notes comparing features, user feedback notes, and performance metrics visible
"white-label community platform","BRAND DOMINANCE: How Elite Businesses Create White-Label Communities That Generate 7-Figure Customer Loyalty","Your competitors still think branding is about logos. Meanwhile, industry leaders are quietly building branded community ecosystems that lock in customers for life. See how these white-label platforms are generating 4X higher retention and turning customers into brand evangelists overnight.",white-label-community,technical-features,$1297,brand building|customer retention|white label software|community engagement,high quality, HD, detailed, High resolution image of a professional business setting with a customized branded community platform displayed across devices, showing unique design elements and engagement statistics
"community platform with gamification","ENGAGEMENT EXPLOSION: The Psychological Gamification Framework That Transformed a Dead Community Into a 24/7 Engagement Machine","'We went from begging for comments to struggling to keep up with notifications...' Discover the counter-intuitive engagement triggers that successful communities are using to create addictive user experiences. Implement these before your competitors catch on.",gamification-community-platform,technical-features,$897,member engagement|gamification|user psychology|community activation,high quality, HD, detailed, High resolution image of a community platform dashboard showing gamification elements like points, badges, and leaderboards with active user engagement metrics visibly increasing
"community software with courses","THE KNOWLEDGE GOLDMINE: How Top Educators Create Premium Course Communities That Students Refuse To Leave","The online course model is dead – but something more profitable has replaced it. Discover why leading educators are abandoning traditional courses for integrated community experiences, and how they're charging 300% more while seeing 5X better completion rates. This shift changes everything.",course-community-platform,technical-features,$1497,online education|course creation|community learning|student engagement,high quality, HD, detailed, High resolution image of an educational community interface showing integrated course materials, student discussions, progress metrics, and engagement analytics on a sleek dashboard
"how to build a community that people will pay for","THE PAYMENT TRIGGER: The Counterintuitive 'Value Reversal' Technique That Makes Members Beg To Pay You Monthly","Forget everything you've heard about free value. The most successful paid communities are using this psychological framework that completely changes how members perceive your worth. Implement these three 'payment triggers' and watch as free members eagerly pull out their credit cards.",building-paid-community,monetization-strategies,$1297,paid membership|community value|subscriber retention|premium pricing,high quality, HD, detailed, High resolution image of a community creator looking surprised at a dashboard showing massive conversion from free to paid memberships, with testimonials and payment notifications visible
"SEO for community platforms","SEARCH ENGINE GOLDMINE: How Savvy Community Owners Are Stealing Google Traffic From Major Publications","While others beg for social media scraps, elite community creators are building unstoppable organic traffic machines. This underground SEO framework specifically for community platforms is generating 10K-50K monthly visitors on autopilot. Implement this before Google's next update changes the game.",seo-community-platform,traffic-strategies,$997,organic traffic|google ranking|search visibility|content strategy,high quality, HD, detailed, High resolution image of a community analytics dashboard showing massive organic traffic growth, with search rankings and conversion metrics prominently displayed
"how to create a paid online community","PROFIT BLUEPRINT: The 3-Phase Community Launch Framework That Generated $103,742 In 30 Days With Zero Prior Audience","'I had no followers, no list, and no connections...' See how a complete unknown launched a paid community that attracted raving members and premium pricing using this repeatable framework. This is NOT about social media or complicated marketing—it's about strategic positioning that sells itself.",create-paid-community,monetization-strategies,$1997,launch strategy|paid membership|community building|creator economy,high quality, HD, detailed, High resolution image of a community launch dashboard showing rapid membership growth and revenue accumulation, with strategic framework documents and launch calendar visible
"Skool vs Mighty Networks","PLATFORM SHOWDOWN: Skool vs Mighty Networks (The Uncensored Comparison After Moving 4 Communities Between Them)","They both promise similar features, but the reality shocked me. After transferring 4 communities with 45,000+ combined members, I discovered critical differences that no review site mentions. See the unfiltered comparison that's saving creators thousands in wasted development and lost members.",skool-mighty-networks-comparison,platform-comparison,$97,platform review|feature comparison|community software|creator tools,high quality, HD, detailed, High resolution image showing split screen comparison of Skool and Mighty Networks interfaces with handwritten notes, feature checklists, and performance metrics visibly highlighting differences
"community analytics platform","MEMBER BEHAVIOR DECODED: The Analytics Framework That Predicts Community Collapse 60 Days Before It Happens","Elite community managers aren't guessing anymore. Discover the predictive dashboard they use to identify disengagement patterns before members leave, turning potential collapse into record-breaking growth. These 5 metrics matter more than all other data combined.",community-analytics,technical-features,$497,data insights|member retention|engagement metrics|predictive analytics,high quality, HD, detailed, High resolution image of a sophisticated analytics dashboard showing community health metrics, engagement patterns, and predictive indicators with clear warning signs and intervention points highlighted
"professional-looking community software","PERCEPTION IS PROFIT: How Premium Positioning In Your Community Design Justifies Charging 5-10X Higher Prices","The secret isn't better content—it's better perception. See how savvy creators are using professional design elements to command premium pricing while delivering similar value. These specific design triggers create instant authority that justifies charging what you're really worth.",professional-community-design,technical-features,$797,premium branding|perceived value|design psychology|pricing strategy,high quality, HD, detailed, High resolution image contrasting amateur vs professional community designs, showing dramatic difference in visual appeal, with pricing pages highlighting the substantial price differential
"is Skool worth $99/month","INVESTMENT OR WASTE? The Brutal Truth About Skool's $99/Month Fee (From Someone Who Generated $537K With It)","Everyone's asking if Skool is worth $99/month. Wrong question. After helping 17 clients build 6 and 7-figure communities, I've uncovered the specific factors that determine whether you'll lose money or create a profit machine. Your success depends on these 5 critical elements no one's talking about.",is-skool-worth-it,platform-comparison,$0,platform review|roi analysis|community software|value assessment,high quality, HD, detailed, High resolution image of a creator analyzing ROI metrics of Skool platform with cost-benefit analysis spreadsheets, profit projections, and actual revenue results visibly displayed
"growing engagement in online community","GHOST TOWN TO GOLD MINE: The Behavioral Science Behind Communities That Never Go Silent","Tired of tumbleweeds in your community? Discover the counterintuitive 'pattern interrupt' technique that transformed our dead community into a 24/7 engagement machine. These psychological triggers create self-sustaining conversation that doesn't require your constant attention.",growing-community-engagement,engagement-strategies,$497,member activation|conversation triggers|community activity|engagement psychology,high quality, HD, detailed, High resolution image of a community dashboard transformation showing dramatic before/after engagement metrics with notification streams and active conversation threads visible
"online community platform","THE PLATFORM PROPHECY: Why Community Platforms Are Creating More Millionaires Than Any Other Business Model In 2025","What Shopify did for e-commerce, this is doing for creators. Discover why venture capitalists are pouring millions into community platforms and how early adopters are positioning themselves at the center of this wealth transfer. The window for early positioning is closing fast.",online-community-platform-guide,platform-fundamentals,$0,creator economy|online community|digital business|recurring revenue,high quality, HD, detailed, High resolution image of futuristic-looking community platform ecosystem with multiple revenue streams flowing to creator, showing business model visualization with growth projections
"how to set up a Skool membership","SKOOL SETUP SECRETS: The 60-Minute Configuration That Separates 6-Figure Communities From Failures","The default Skool setup is costing you thousands. Discover the exact configuration changes implemented by top-earning communities that dramatically increase conversion and retention. These 7 critical settings make the difference between struggling and scaling.",skool-membership-setup,platform-tutorials,$47,skool tutorial|membership setup|configuration guide|community launch,high quality, HD, detailed, High resolution image of a creator optimizing Skool membership settings on a computer, with before/after conversion metrics clearly visible and specific settings highlighted
"best platform for online course community","THE LEARNING REVOLUTION: Why Top Course Creators Are Abandoning Traditional Platforms For This Integrated Approach","The standalone course is dying. Discover why leading educators are seeing 320% higher completion rates and charging 4X more by switching to this integrated community-course model. The transformation in student results is creating raving fans and unstoppable referrals.",best-course-community-platform,platform-comparison,$197,online education|course creation|learning community|student engagement,high quality, HD, detailed, High resolution image comparing traditional course platform to integrated community-course environment, with engagement metrics, completion rates, and revenue figures showing dramatic improvement
"ad-free community platform","ATTENTION SANCTUARY: How Elite Communities Create Distraction-Free Spaces That Members Gladly Pay Premium Prices For","In an age of algorithmic manipulation, attention has become the ultimate currency. Discover why members are fleeing ad-saturated networks for dedicated platforms, and how creators are charging premium rates for distraction-free experiences. This shift in member psychology changes everything.",ad-free-community-platform,platform-fundamentals,$0,digital sanctuary|attention economy|premium experience|member focus,high quality, HD, detailed, High resolution image contrasting cluttered social media interfaces with clean, focused community platform, showing peaceful member experience with high engagement metrics
"community platform with live streaming","BROADCAST EMPIRE: The Live Streaming Community Framework That's Generating 7-Figures While Social Platforms Restrict Reach","While social algorithms bury your content, smart creators are building sovereign broadcast networks. See how this integrated live-streaming community approach is creating deeper engagement and multiple revenue streams that social platforms can't touch.",live-streaming-community,technical-features,$997,live video|broadcast strategy|audience engagement|monetization,high quality, HD, detailed, High resolution image of creator broadcasting to engaged community on integrated platform with live reactions, attendance metrics, and multiple monetization streams activated
"ethical ways to monetize community","THE INTEGRITY ADVANTAGE: How Ethical Monetization Creates More Profitable Communities Than Hard-Sell Tactics","Manipulative monetization is dead. Discover why the most profitable communities are using ethical, value-aligned revenue models that members actually celebrate. These 5 ethical monetization frameworks generate more revenue with zero resistance or backlash.",ethical-community-monetization,monetization-strategies,$497,value-based pricing|ethical business|member trust|sustainable revenue,high quality, HD, detailed, High resolution image showing contrast between pushy sales tactics and ethical monetization approach, with member testimonials and revenue comparison metrics clearly visible
"business coaching community platform","EXPERT ELEVATION: The Business Coaching Community Framework That Commands $5-10K Per Member While Delivering Transformational Results","One-on-one coaching doesn't scale. Group programs lack personalization. See how elite business coaches are using this community platform to create the perfect hybrid approach that scales to seven figures while delivering better client results than ever before.",business-coaching-community,niche-communities,$2997,business coaching|high-ticket clients|community design|transformation framework,high quality, HD, detailed, High resolution image of business coaching community in action, showing collaborative problem-solving, high-level strategy discussions, and client success metrics on a professional dashboard
"online fitness coaching community","FITNESS FREEDOM FORMULA: How Smart Trainers Build 6-Figure Communities While Others Struggle With $20 One-Off Programs","'I went from exhausted $50/hour sessions to a $37K/month community on autopilot...' Discover how forward-thinking fitness pros are building thriving membership communities that deliver better client results with 80% less personal time investment.",fitness-coaching-community,niche-communities,$1497,fitness business|online coaching|recurring revenue|client transformation,high quality, HD, detailed, High resolution image of fitness professional managing online community with workout programs, nutrition protocols, and client progress tracking all visible on a comprehensive dashboard
"must-have features for community platform","THE FEATURE MATRIX: 7 Critical Community Platform Elements That Separate Thriving Communities From Ghost Towns","Not all platform features are created equal. This research on 132 communities reveals which specific features correlate with growth and which are complete wastes of money. Before choosing your platform, see which elements actually drive engagement versus which just look good in demos.",must-have-community-features,platform-fundamentals,$197,platform selection|community software|engagement features|technical requirements,high quality, HD, detailed, High resolution image of a feature comparison matrix document on a desk, with critical community platform elements highlighted and prioritized, showing impact metrics for each feature
"Skool community pricing","PRICING DECODED: The Strategic Psychology Behind Skool's Pricing (And How Smart Creators Turn It Into A 100X ROI Asset)","$99/month seems expensive until you understand this. Discover the strategic economic model Skool uses that actually generates more profit for creators than cheaper alternatives. See why serious community builders see this as an investment, not an expense.",skool-pricing-explained,platform-comparison,$0,platform pricing|roi analysis|business investment|creator economics,high quality, HD, detailed, High resolution image of a business person analyzing Skool pricing structure with ROI calculations, profit projection models, and comparison metrics with cheaper alternatives
"trading community platform","INSIDER ADVANTAGE: How Elite Traders Are Building Specialized Communities That Consistently Outperform Market Indexes","The lone wolf trader is becoming extinct. Discover why serious market players are joining specialized communities that provide edge through collective intelligence. These platforms are creating more consistent returns than any trading course or signal service.",trading-community-platform,niche-communities,$2497,investment strategy|trading group|market analysis|financial community,high quality, HD, detailed, High resolution image of traders collaborating in a specialized online community with multiple market charts, strategy discussions, and performance tracking metrics visible
"how to grow a Skool community from scratch","ZERO TO THOUSANDS: The 90-Day Roadmap That Built a Thriving Skool Community Without An Existing Audience","'I started with zero followers and hit 5,000 members in 87 days...' Discover the counterintuitive growth framework that doesn't rely on existing fame or social media. This strategic approach attracts perfect-fit members who engage deeply and stay long-term.",grow-skool-community,growth-strategies,$997,community building|member acquisition|engagement strategy|growth tactics,high quality, HD, detailed, High resolution image of a Skool community growth dashboard showing exponential member increase, with strategic roadmap documents and acquisition channel performance visible
"distraction-free community platform","FOCUS REVOLUTION: Why Members Are Fleeing Noisy Networks For Specialized Communities (And Paying Premium Prices For It)","The attention economy is broken. Discover why thoughtful conversations are impossible on mainstream platforms and how specialized communities are creating the signal-to-noise ratio members desperately crave. This shift in member psychology changes everything.",distraction-free-community,platform-fundamentals,$0,digital wellness|focused engagement|premium experience|audience attention,high quality, HD, detailed, High resolution image contrasting overwhelming social media noise with serene, focused community platform interface, showing meaningful discussions versus algorithmic chaos
"setting up membership questions for community","THE QUALIFICATION FILTER: How Strategic Onboarding Questions Create Self-Policing Communities That Stay Valuable","Your community problems start at the door. Discover how elite community architects use strategic qualifying questions to create perfectly-aligned membership that practically moderates itself. These psychological filters ensure only ideal members join while maintaining explosive growth.",membership-questions-guide,engagement-strategies,$197,member screening|community culture|onboarding process|quality control,high quality, HD, detailed, High resolution image of a community onboarding sequence showing strategic membership questions, with filtering metrics and quality indicators highlighting how it improves community composition
"creating dopamine-driven community onboarding","ADDICTION BY DESIGN: The Neurochemical Onboarding Framework That Creates Instant Community Addiction (Ethically)","First impressions are everything. Discover the strategic onboarding sequence top communities use to trigger dopamine-driven engagement patterns that last for months. These psychological triggers create habitual platform usage without manipulative tactics.",dopamine-driven-onboarding,engagement-strategies,$697,member activation|engagement psychology|onboarding sequence|habit formation,high quality, HD, detailed, High resolution image of a community onboarding experience with neurochemical triggers highlighted, showing engagement metrics increasing dramatically after implementation
"community monetization without transaction fees","FEE FREEDOM: How Savvy Community Owners Eliminate Transaction Costs That Silently Steal 30% Of Your Revenue","The fees you're not seeing are costing you thousands. Discover how top community owners structure their payment systems to eliminate the hidden transaction costs that silently erode your profits. This financial architecture can recover up to 30% of your revenue overnight.",eliminate-transaction-fees,monetization-strategies,$497,payment processing|revenue optimization|financial structure|profit maximization,high quality, HD, detailed, High resolution image of financial dashboard comparing traditional payment processing with fee-free structure, showing dramatic difference in kept revenue with actual numbers highlighted
"community platform API integrations","ECOSYSTEM MASTERY: How Tech-Savvy Creators Build Custom Community Empires That Outperform Cookie-Cutter Solutions","Off-the-shelf isn't enough anymore. Discover how forward-thinking creators use strategic API integrations to build custom community experiences their competitors can't match. These technical advantages create unique member experiences that command premium pricing.",api-integration-guide,technical-features,$997,technical customization|platform integration|automation|workflow optimization,high quality, HD, detailed, High resolution image of developer workspace showing API connection diagrams, custom integration code, and unified community ecosystem spanning multiple platforms and functions
